機構名稱,縣市,行政區,地址全址,特約服務項目,機構電話,電子郵件,機構負責人姓名
社團法人台灣樂活服務發展協會(板橋港尾站)(社照C),新北市,板橋區,新北市板橋區埔墘里中山路2段318巷20弄5號1樓,巷弄長照站,0926-267853,jilingdong2013@gmail.com,馬瑞辰
新北市板橋大後埔文化關懷協進會(板橋重慶站)(社照C),新北市,板橋區,新北市板橋區重慶里國慶路149巷3弄7號,巷弄長照站,918063168,sunlai689@gmail.ocm, 王明發
新北市板橋區大浮洲發展協進會(板橋大安站)(社照C),新北市,板橋區,新北市板橋區大安里大觀路二段7巷14號1樓,巷弄長照站,923618811,yusulan0987189148@gmail.com,林新添
新北市板橋區大後埔文化關懷協進會(板橋信義站)(社照C),新北市,板橋區,新北市板橋區港尾里中正路336之1號1樓,巷弄長照站,918063168,sunlai689@gmail.com,王明發
新北市板橋區勞工志工服務協會(板橋廣德站)(社照C),新北市,板橋區,新北市板橋區廣德里重慶路245巷32弄18號,巷弄長照站,918063168,sunlai1241689@gmail.com,林治勳
中華全人運動照護管理協會(社照C),新北市,三重區,新北市三重區富貴里三賢街103號1樓,巷弄長照站,973000549,u4vup0603@gmail.com,蕭淑萍
社團法人寧祈全人健康生命關懷協會附設臺北市私立寧祈居家長照機構,臺北市,中山區,臺北市中山區中山里民生東路1段42號12樓之14,居家服務,02-2521-3282,homeservice@ningchi.org,吳健樑
新北市淡水區鄧公社區發展協會(社照C),新北市,淡水區,新北市淡水區鄧公里鄧公路32巷7號1樓,巷弄長照站,02-262521000912-526336,meichin.chiu@msa.hinet.net,邱美津
社團法人台灣多元社會福利協會(永和禧德站)(社照C),新北市,永和區,新北市永和區新廍里文化路90巷33號1樓,巷弄長照站,02-29251469,sd29251469@gmail.com,林政緯
新北市多元智能老幼暨兒童教育發展協會(鶯歌站)(社照C),新北市,鶯歌區,新北市鶯歌區鳳福里福隆一街14號,巷弄長照站,22895931,elite.everyday@gmail.com,李姿慧
餘慶之家健康股份有限公司附設臺北市私立餘慶居家長照機構,臺北市,中正區,臺北市中正區和平西路一段109號1樓,居家服務,02-2558-1655,w26547183@gmail.com,郭濟安
北醫大管理顧問股份有限公司附設私立杏芳居家長照機構,臺北市,文山區,臺北市文山區景後街190號2樓之1,喘息服務,02-29350230#200,careplus.wf@gmail.com,張詩鑫
秉心有限公司附設臺北市私立秉心居家長照機構,臺北市,松山區,臺北市松山區光復北路119-1號2樓,喘息服務,02-27666683,pingshinghome@gmail.com,陳欣怡
財團法人佳醫健康基金會附設臺北市私立佳醫居家長照機構,臺北市,松山區,臺北市松山區南京東路五段8-10號503室,喘息服務,02-25280502,carrie516899@gmail.com,蘇秀鑾
新北市私立宜安老人長期照顧中心(養護型),新北市,中和區,新北市中和區泰安里景安路48號7樓,喘息服務,02-2240935,chingan2005@gmail.com,黃明發
財團法人弘道老人福利基金會附設臺北市私立西松社區長照機構,臺北市,松山區,臺北市松山區東榮里南京東路五段251巷46弄5號,日間照顧服務,02-27616300,laughing@hondao.org.tw,王乃弘
臺北市政府社會局委託財團法人台灣省私立健順養護中心經營管理南港社區式長照機構,臺北市,南港區,臺北市南港區重陽里重陽路187巷5號,日間照顧服務,02-26535311,nkelder@gmail.com,黃禎祥
臺北市私立康健居家式長照機構,臺北市,內湖區,臺北市內湖區寶湖里民權東路6段180巷6號11F之19,喘息服務,02-87919104,kjcare.tw@gmail.com,吳姁媛
財團法人弘道老人福利基金會附設臺北市私立西松社區長照機構,臺北市,松山區,臺北市松山區東榮里南京東路五段251巷46弄5號,小規模多機能服務,02-27616300,laughing@hondao.org.tw,王乃弘
財團法人台北市私立愛愛院,臺北市,萬華區,臺北市萬華區大理街175巷27號,喘息服務,02-23060493,csp1@aiai.org.tw,施武靖
財團法人弘道老人福利基金會附設臺北市私立西松社區長照機構,臺北市,松山區,臺北市松山區東榮里南京東路五段251巷46弄5號,營養餐飲服務,02-27616300,laughing@hondao.org.tw,王乃弘
臺北市政府社會局委託中華民國紅十字會台灣省分會經營管理臺北市中正社區長照機構,臺北市,中正區,臺北市中正區建國里貴陽街一段60號3樓,營養餐飲服務,02-23831958,rct03702883@gmail.com,董光式
財團法人一粒麥子社會福利慈善事業基金會(嶺腳里)(社照C),新北市,新店區,新北市新店區民權路42巷59弄12號5樓,巷弄長照站,02-89117897 #12、#15,W104116@wheat.org.tw,呂信雄
適群診所,臺北市,大安區,臺北市大安區四維路198巷32號,居家失能個案家庭醫師照護服務,02-27063700,mollylin2886@gmail.com,蔡函衿
臺北市立聯合醫院附設仁愛護理之家,臺北市,大安區,臺北市大安區仁愛路四段10號南棟4樓,日間照顧服務,"02-27093600 分機1520, 1521",B0076@tpech.gov.tw,方志嘉
臺北市政府社會局委託財團法人台北市立心慈善基金會經營管理臺北市萬華龍山社區長照機構,臺北市,萬華區,臺北市萬華區青山里梧州街36號3樓之1,日間照顧服務,02-23361881,longshanold@gmail.com,洪金桐
栢麗恆全人診所,臺北市,信義區,臺北市信義區忠孝東路五段431號2樓,居家失能個案家庭醫師照護服務,02-2765-7065,ymyhl2@gmail.com,葉恒良
芊潁顧問有限公司附設臺北市私立芊潁居家長照機構,臺北市,中山區,臺北市中山區行政里建國北路3段94號2樓(D201室),喘息服務,02-2508-0383,qianyingoffice@gmail.com,何冠潁
泉益居家有限公司附設臺北市私立泉益居家長照機構,臺北市,文山區,臺北市文山區忠順街一段20號1樓,喘息服務,02-86618880,chuanyi10910@gmail.com,詹弘毅
臺北市政府社會局委託中華民國紅十字會台灣省分會經營管理臺北市中正社區長照機構,臺北市,中正區,臺北市中正區建國里貴陽街一段60號3樓,日間照顧服務,02-23831958,rct03702883@gmail.com,董光式
台北市梘尾關懷互助協會,臺北市,文山區,臺北市文山區景慶里萬慶街6號,巷弄長照站,02-89351788,older.hearing@msa.hinet.net,蔡淵輝
財團法人一粒麥子社會福利慈善事業基金會(中正國宅社區照顧關懷據點),臺北市,萬華區,臺北市萬華區新安里萬大路237巷13弄3號,巷弄長照站,02-2309-0660,liz@wheat.org.tw,呂信雄
粱耳鼻喉科診所,臺北市,士林區,臺北市士林區社正路12-1號,居家失能個案家庭醫師照護服務,02-2816-8456,kimbo@doctorvoice.org,楊境森
社團法人中華民國香柏樹長者社區關懷協會,臺北市,內湖區,臺北市內湖區東湖里康樂街110巷16弄20號5樓,營養餐飲服務,(02)6325560,nhsc.knjc@gmail.com,黃哲人
皓仁健康照護事業有限公司附設新北市私立皓仁居家式服務類長期照顧服務機構,新北市,汐止區,新北市汐止區大同里大同路二段240號11樓,喘息服務,02-26480680,yenjen@haoren.com.tw,謝李麗雲
社團法人中華民國新生活社會福利促進會(社照C),新北市,三芝區,新北市三芝區埔頭里43-1號,巷弄長照站,02-26368398,lkd0901@newlifesw.org.tw,蘇興李
台灣居護股份有限公司附設臺北市私立聯承居家長照機構,臺北市,大安區,臺北市大安區義村里忠孝東路3段136號11樓1102辦公室,居家服務,82588088,thnbuurtzorg@gmail.com,汪秋蓉
臺北市私立前瞻居家長照機構,臺北市,文山區,臺北市文山區興昌里辛亥路4段21巷10號9樓,居家服務,02-8931-2545,h89312545@gmail.com,楊邦媛
忠孝事業有限公司附設臺北市私立忠孝居家長照機構,臺北市,北投區,臺北市北投區榮華里明德路283號3樓,居家服務,2821-4922,zhongxiao88165821@gmail.com,陳君慧
社團法人中華長照協會附設臺北市私立永樂居家長照機構,臺北市,文山區,臺北市文山區羅斯福路六段134號2樓,居家服務,02-2930-6919,chxclc001@gmail.com,金國良
社團法人中華民國新希望關懷協會(社照C),新北市,林口區,新北市林口區湖南里文林六街62巷11號1樓,巷弄長照站,02-26099990,elaine945@gmail.com,楊鑫
臺北市私立家福居家長照機構,臺北市,信義區,臺北市信義區六合里松仁路252號1樓,居家服務,87861127,joyce910524@yahoo.com.tw,張嘉真
台北市士林區天和社區發展協會,臺北市,士林區,臺北市士林區天山里中山北路7段154巷6號4樓(天母區民活動中心),巷弄長照站,02-28772369,eva889263@yahoo.com.tw,何辰熙
臺北市大安區法治里辦公處,臺北市,大安區,臺北市大安區法治里通化街192號,巷弄長照站,980403536,michellelin0207@yahoo.com.tw,林佩燕
財團法人陽明山基督教天母禮拜堂,臺北市,士林區,臺北市士林區天母里中山北路7段216巷1號1樓,巷弄長照站,02-2871-1622#25,bible2312@gmail.com,王騰敏
士林區芝山岩社區發展協會,臺北市,士林區,臺北市士林區名山里雨聲街68號(芝山岩區民活動中心),巷弄長照站,911328596,yueh2158@pchome.com.tw,廖岳
社團法人台灣樂活服務發展協會(樂活社子),臺北市,士林區,臺北市士林區社子里延平北路6段82巷5號,巷弄長照站,983108777,saxochi@gmail.com,馬瑞辰
台北市新生活社會福利協進會,臺北市,士林區,臺北市士林區富洲里延平北路九段122號,巷弄長照站,937094689,office@tpenewlife.org,張淑貞
財團法人台北市聖佳蘭先開懷社會福利慈善基金會,臺北市,士林區,臺北市士林區陽明里建業路73巷10 號,巷弄長照站,02-28614057,sylg.533@gmail.com,黃翠芳
社團法人中華仁親社區關懷協會(士林好厝邊),臺北市,士林區,臺北市士林區義信里基河路128號(士林靈糧堂),巷弄長照站,228803408,Ericlin7028@gmail.com,劉群茂
臺北市士林區葫東里辦公處,臺北市,士林區,臺北市士林區葫東里中正路589號1樓,巷弄長照站,0933-716-265,daisykuo@hotmail.com,郭淑玲
臺北市士林區福中里辦公處,臺北市,士林區,臺北市士林區福中里福港街151號10樓9樓,巷弄長照站,228838207,hsiulien0317@gmail.com,王德利
社團法人台北市士林全人關懷協會,臺北市,士林區,臺北市士林區福德里文林路421巷30號2樓&中正路335巷9號,巷弄長照站,953469293,kuoml67@yahoo.com.tw,許承道
臺北市士林區德行里里辦公處,臺北市,士林區,臺北市士林區德行里德行西路30號1樓,巷弄長照站,0939-931-903,majasmine519@gmail.com,張僡美
臺北市大安區古風社區發展協會,臺北市,大安區,臺北市大安區古風里師大路117巷1號  雲和街72巷9號,巷弄長照站,983293018,fanghui100@gmail.com,邱信賢
臺北市大安區民炤里辦公處,臺北市,大安區,臺北市大安區民炤里信義路3段31巷5號1樓,巷弄長照站,02-27008406,c20181124@gmail.com,周暉泰
財團法人台北市中華基督教衛理公會衛理堂,臺北市,大安區,臺北市大安區民輝里新生南路1段113號,巷弄長照站,02-2771-2017#141,joshua87427@gmail.com,歐陽讓
臺北市大安區永康里辦公處,臺北市,大安區,臺北市大安區永康里金華街199巷3弄6號1樓,巷弄長照站,931234954,yongkangvillage@gmail.com,李明螢
臺北市大安區光明里辦公處,臺北市,大安區,臺北市大安區光明里信義路2段86巷26號,巷弄長照站,0928-924384,q23914185@gmail.com,張惠銓 
台北市通化玫瑰社會關懷協會,臺北市,大安區,臺北市大安區法治里通化街178號,巷弄長照站,0975-227919,peteryeh2009@gmail.com,葉永誠 
社團法人中華生命關愛協會,臺北市,大安區,臺北市大安區芳和里和平東路3段212巷12號,巷弄長照站,922407837,chowyinhwa@gmail.com,周音華
臺北市大安區通安里辦公處,臺北市,大安區,臺北市大安區通安里通安街98號 (臺北市通安區民活動中心),巷弄長照站,02-2703-8807,bi-garytu@mail.taipei.gov.tw,鄭文明
臺北市大安區大安新龍社區發展協會,臺北市,大安區,臺北市大安區新龍里信義路三段134巷98號1樓,巷弄長照站,02-2706-7771,t123411@hotmail.com,李沈素勤
社團法人台灣德安社會福利協會受託經營管理臺北市大安老人服務中心,臺北市,大安區,臺北市大安區德安里四維路76巷12號,巷弄長照站,27086255,daanolder@gmail.com,陳敏雄
臺北市大安區錦町社區發展協會,臺北市,大安區,臺北市大安區錦安里潮州街130巷3號1樓,巷弄長照站,02-2351-5967,chk550505168@gmail.com,龔志慧
臺北市大安區錦華里辦公處 ,臺北市,大安區,臺北市大安區錦泰里羅斯福路2段35巷19弄6號1樓,巷弄長照站,02-23511711#8238,bi-s9091006@mail.taipei.gov.tw,溫美珠
社團法人台灣愛鄰社區服務協會(大安區),臺北市,大安區,臺北市大安區龍門里和平東路二段24號11樓,巷弄長照站,02-23692674,peter.chu@breadoflife.taipe,莊碧明
臺北市私立好運居家長照機構,臺北市,內湖區,臺北市內湖區葫洲里民權東路6段266號6樓,居家服務,02-2631-0670,haoyun26310670@gmail.com,汪新儀
臺北市士林區福順里辦公處,臺北市,士林區,臺北市士林區福順里延平北路5段136巷24號,巷弄長照站,0958-830-605,bn_526@mail.taipei.gov.tw,林家卉
社團法人臺北市中山區大直社區發展協會(大直一),臺北市,內湖區,臺北市內湖區寶湖里民權東路六段208號,巷弄長照站,0931-302823,bl-yuhsin@mail.taipei.gov.tw,宋羅蘭
財團法人台灣老人急重症基金會(聚盛據點),臺北市,中山區,臺北市中山區聚盛里民生東路一段42號7樓之3,巷弄長照站,02-25224388,tfgecc@tfgecc.tw,蔡正河
社團法人台北市家庭照顧者關懷協會,臺北市,中山區,臺北市中山區北安里北安路805巷4弄5號地下,巷弄長照站,916780645,tachih70@yahoo.com.tw,李孟芬
財團法人臺北市松年長春社會福利基金會(中山),臺北市,中山區,臺北市中山區行仁里龍江路318巷7號1樓,巷弄長照站,02-2500-0206,pine004@twdc.org.tw,黃春生
臺北市中山區晴光里辦公處,臺北市,中山區,臺北市中山區晴光里雙城街18巷20號,巷弄長照站,981201026,janny0918@gmail.com,林姿吟
臺北市復華長青多元服務中心(財團法人台灣省私立健順養護中心),臺北市,中山區,臺北市中山區復華里遼寧街185巷11號,巷弄長照站,02-2717-1393#16,fuhua1060810@gmail.com,黃禎祥
臺北市快樂松年社,臺北市,中山區,臺北市中山區新生里民權東路2段46號3樓之2,巷弄長照站,920220422,cynthia422@yahoo.com.tw,羅聯昇
財團法人台北市東門基督長老教會,臺北市,中正區,臺北市中正區三愛里仁愛路二段76號,巷弄長照站,02-23513589,egate.tp@gmail.com,鄭愛玲
財團法人伽耶山基金會,臺北市,中正區,臺北市中正區文北里濟南路二段36號2樓、3樓、4樓,巷弄長照站,02-2394-6800#403,twlate2014@gmail.com,陳夏珠  
臺北市中正區永寬社區發展協會,臺北市,中正區,臺北市中正區永昌里寧波西街181巷8號,巷弄長照站,02-23014838,4838abc@gmail.com,黃美月
台北市寶藏巖文化村協會,臺北市,中正區,臺北市中正區水源里汀州路三段230巷14弄10號,巷弄長照站,926579112,thcca2012@gmail.com,徐聖情 
臺北市中正區新永昌社區發展協會,臺北市,中正區,臺北市中正區永昌里汀州路1段242巷17號,巷弄長照站,966452161,hcn630@gmail.com,許巧妮 
臺北市中正區新營里辦公處,臺北市,中正區,臺北市中正區新營里寧波東街16巷4號1樓,巷弄長照站,02-23214028,sophia.ja18@gmail.com,何國榮
臺北市中正區櫻花社區發展協會,臺北市,中正區,臺北市中正區網溪里牯嶺街165號,巷弄長照站,919940027,s33651923@yahoo.com.tw,夏萬浪
臺北市中正區螢橋社區發展協會,臺北市,中正區,臺北市中正區螢雪里福州街59號1樓,巷弄長照站,02-23052201,yijyechen@gmail.com,陳文質 
台北市愛羊全人關懷協會,臺北市,中正區,臺北市中正區龍光里和平西路二段17號2樓,巷弄長照站,0937-888594,keng2727@yahoo.com.tw,葉姿伶 
臺北市內湖區石潭社區發展協會,臺北市,內湖區,臺北市內湖區石潭里成功路二段1號2樓,巷弄長照站,02-27937177,shuru571110@gmail.com,廖煒國
財團法人中華民國台灣基督教信義會內湖教會,臺北市,內湖區,臺北市內湖區港都里港墘路100巷2號1樓,巷弄長照站,02-27993958,lipkao@gmail.com,陳至敏
內湖區湖興里辦公處,臺北市,內湖區,臺北市內湖區湖興里成功路二段320巷19號3樓,巷弄長照站,02-27914586,mor6168@gmail.com,蔡穎峰
內湖區寶湖里辦公處,臺北市,內湖區,臺北市內湖區寶湖里民權東路六段208號,巷弄長照站,0931-302823,bl-yuhsin@mail.taipei.gov.tw,邱顯松
臺北市文山區木柵社區發展協會,臺北市,文山區,臺北市文山區木柵里久康街92-1號,巷弄長照站,0933-220278,kh8113@gmail.com,高銘傳
財團法人台北市松年長春社會福利基金會(開元),臺北市,文山區,"臺北市文山區木新里開元街25,27號",巷弄長照站,02-2500-0206,"pine004@twdc.org,tw",王淑惠
家禾認知社區關懷協會,臺北市,文山區,臺北市文山區政大里政大1街3號1樓,巷弄長照站,02-2234-2467,scchaochao@gmail.com,周存林
臺北市文山區華興里辦公處,臺北市,文山區,臺北市文山區華興里木柵路一段264號,巷弄長照站,905991580,huaxing0607@gmail.com,陳峙穎
台北市文山區景慶社區發展協會,臺北市,文山區,臺北市文山區景慶里景福街126號,巷弄長照站,02-25183311分機310,a313747@gmail.com,馬紹俊
台灣迦美福音傳播協會,臺北市,文山區,臺北市文山區景華里三福街74巷2號1樓,巷弄長照站,02-29348952,olivetreepeng@yahoo.com.tw,朱信介
社團法人台灣厝邊有愛關懷協會(台北公舘),臺北市,文山區,臺北市文山區萬年里汀州路四段85巷2號,巷弄長照站,02-23635546,lo1119@ms53.hinet.net,鄭忠仁
臺北市文山區順興里辦公處,臺北市,文山區,臺北市文山區順興里興隆路4段165巷50號1樓,巷弄長照站,972246029,bs-pstchsien@mail.tapei.gov.tw,楊培釧
財團法人台北市活石基督徒團契,臺北市,文山區,臺北市文山區萬興里指南路二段45巷24弄17號,巷弄長照站,925230295,lingling7475@yahoo.com.tw,謝長安
臺北市文山區興旺社區發展協會,臺北市,文山區,臺北市文山區興旺里福興路27號,巷弄長照站,936048808,junghuiliao@gmail.com,陳忠榮
台北市北投青溪協會,臺北市,北投區,臺北市北投區中庸里珠海路2號,巷弄長照站,台北市北投區中庸里珠海路2號,skyfu218@gmail.com,陳宗陽
臺北市北投區永和社區發展協會,臺北市,北投區,臺北市北投區永和里行義路138-1號1樓,巷弄長照站,910069290,l5168@hotmail.com,陳世正
臺北市北投區幸福永和社區發展協會,臺北市,北投區,臺北市北投區永和里行義路63號,巷弄長照站,928363298,rita354169@gmail.com,高秀蘭
台北市北投區新石牌社區發展協會,臺北市,北投區,臺北市北投區石牌里自強街120巷15弄8號,巷弄長照站,(02)2823-6699,j19830406@gmail.com,劉世豪
臺北市北投區我愛石牌社區發展協會,臺北市,北投區,臺北市北投區石牌里建民路116巷13 號,巷弄長照站,0928-228-369,lv228369@me.com,吳明益
社團法人國際奔享體驗教育發展協會(吉利真光),臺北市,北投區,臺北市北投區吉利里石牌路一段39巷80弄41號1樓,巷弄長照站,02-28288884,gieeda.gieeda@gmail.com,曾美蘭
臺北市北投區吉慶社區發展協會,臺北市,北投區,臺北市北投區吉慶里致遠二路61巷2-2號,巷弄長照站,02-2828-2002,tsung34@yahoo.com.tw,陳绣絹
台北市基督教新城教會,臺北市,北投區,臺北市北投區東華里東華街2段180之1號,巷弄長照站,02-28236310,a0916983917@gmail.com,黎秉劼
財團法人台北市北投文化基金會,臺北市,北投區,臺北市北投區林泉里中山路5-12號,巷弄長照站,02-28917453,smiler826@gmail.com,詹儒宗
台北市石牌長青會,臺北市,北投區,臺北市北投區長安里中央北路1段12號3樓及4樓,巷弄長照站,911251092,skyfu218@gmail.com,白惠萍
台北市石牌全人關懷協會,臺北市,北投區,臺北市北投區榮華里明德路283號,巷弄長照站,02-28262602*11,candykaofeeling@gmail.com,許曉元
臺北市松山區中正里辦公處,臺北市,松山區,臺北市松山區中正里長安東路二段229號12樓,巷弄長照站,0937-031518,ruru19841224@gmail.com,洪樸陽
社團法人台灣厝邊有愛關懷協會（敦化）,臺北市,松山區,臺北市松山區民有里敦化北路238巷7-9號,巷弄長照站,02-3635546,lo1119@ms53.hinet.net,鄭忠仁
台北市松山區松榮社區發展協會,臺北市,松山區,臺北市松山區東榮里民生東路5段69巷3號1樓,巷弄長照站,02-27676931,eliahom@gmail.com,鄭玉梅
臺北市松山區東勢里辦公處,臺北市,松山區,臺北市松山區東勢里南京東路4段133巷8弄17號,巷弄長照站,02-27170369,bh_ssda207@mail.taipei.gov.tw,王叔珍
財團法人台北市林坤地仁濟文教基金會,臺北市,松山區,臺北市松山區美仁里八德路3段25號藝文推廣處二樓電化教室,巷弄長照站,02-2751-5790,tkyang03@gmail.com,楊杜清香
社團法人愛樂福關懷文創發展協會,臺北市,松山區,臺北市松山區莊敬里撫遠街367巷4號,巷弄長照站,926623482,tyy59792000@gmail.com,王澤民
松山區建源社區發展協會,臺北市,松山區,臺北市松山區復建里八德路3段158巷7弄20號(復建區民活動中心),巷弄長照站,02-25791689,shiohow@yahoo.com.tw,陳秀華
財團法人台北市私立永年社會福利慈善基金會,臺北市,松山區,臺北市松山區復勢里光復北路80巷1號1樓,巷弄長照站,02-2578-6677#2232,socialwork@pojengh.com.tw,王建哲
財團法人雙福社會福利慈善事業基金會(蒙恩),臺北市,松山區,臺北市松山區復勢里光復北路112號8樓,巷弄長照站,02-2392-2993分機12,asiapd@gmail.com,吳英賓
臺北市松山區龍田里辦公處,臺北市,松山區,臺北市松山區龍田里光復北路230巷21號B1,巷弄長照站,988179571,bh_ssda207@mail.taipei.gov.tw,袁俊麒
財團法人台灣省私立健順養護中心(松山老人服務暨日間照顧中心),臺北市,松山區,臺北市松山區鵬程里健康路317號1樓,巷弄長照站,02-2768-5636,sselder105@gmail.com,黃禎祥
臺北市松山區慈祐里辦公處,臺北市,松山區,臺北市松山區慈祐里八德路4段580號1樓,巷弄長照站,938889576,casper255058@gmail.com,李祖民 
財團法人台北市基督教全人福利事業基金會(吳興教會),臺北市,信義區,臺北市信義區三張里吳興街269巷18弄6號,巷弄長照站,02-2758-9796,joan0801@ms68.hinet.net,鍾梅香
台北市信義區三犁里辦公處,臺北市,信義區,臺北市信義區三犁里信義路5段150巷14弄6號1樓,巷弄長照站,0911-822-428,sing.keego@gmail.com,翁信利
臺北市信義區中行里辦公處,臺北市,信義區,臺北市信義區中行里福德街268巷32號,巷弄長照站,02-2727-4777,zhongxing@zx.attw.idv.tw,林美君
台北市君賀人本關懷協會,臺北市,信義區,臺北市信義區中行里福德街221巷15號（瑠公國中）,巷弄長照站,02-2327-8616,bio.mag@msa.hinet.net,林露菁
財團法人台北市中華基督教信義會(復興堂),臺北市,信義區,臺北市信義區中興里信義路4段375號10樓之2,巷弄長照站,02-27200440,fushing.fushing@gmail.com,吳大明
臺北市信義區五全里辦公處,臺北市,信義區,臺北市信義區五全里永吉路278巷1弄13號,巷弄長照站,02-2762-0007,wu--quan@hotmail.com,吳秀好
財團法人台北市中華基督教藝人之家,臺北市,信義區,臺北市信義區五常里松隆路102號13樓,巷弄長照站,02-27674567,artists.as@gmail.com,黃榮勇
臺北市信義區挹翠社區發展協會,臺北市,信義區,臺北市信義區六合里紫雲街23號1樓,巷弄長照站,02-27228636,ghda970525@gmail.com,甘添貴
臺北市信義區西村里辦公處,臺北市,信義區,臺北市信義區西村里基隆路一段364巷22號,巷弄長照站,939585853,vb-10394@mail.taipei.cov.tw,馬念慈
松光里辦公處,臺北市,信義區,臺北市信義區松光里忠孝東路5段492巷32號,巷弄長照站,0961-364-097,lichi06290@hotmail.com,蔡福來
臺北市信義區永安社區發展協會,臺北市,信義區,臺北市信義區長春里松山路294號4樓,巷弄長照站,02-27238588,chen.cct2622@msa.hinet.net,陳林錦華
臺北市信義區惠安里辦公處,臺北市,信義區,臺北市信義區惠安里吳興街506巷21號,巷弄長照站,0921-912-430,bp-30290@mail.taipei.gov.tw,周葉長
中華民國老人福利協進會,臺北市,信義區,臺北市信義區嘉興里信安街78號2樓,巷弄長照站,02-27382357,catychou_3067@yahoo.com.tw,高火生
臺北市全人探索協會,臺北市,南港區,臺北市南港區玉成里八德路4段768-1號4-6樓,巷弄長照站,"	0932322435",x9exlo@gmail.com,黃聰智
財團法人台北市中國基督教靈糧世界佈道會台北靈糧堂(雙園靈糧福音中心),臺北市,萬華區,臺北市萬華區和德里西園路2段362及 364號4樓、362號5樓,巷弄長照站,02-2362-3022#8713,niko.tsai@breadoflife.taipei,曾國生
臺北市和德長壽健康促進協會,臺北市,萬華區,臺北市萬華區和德里興義街25號,巷弄長照站,02-23395285,wh-178@mail.taipei.gov.tw,李文通
中華民國雙囍老人義務教育推廣協會,臺北市,萬華區,臺北市萬華區壽德里萬大路411號2樓,巷弄長照站,02-2331-7158#18,luckyold1020915@gmail.com,張碧雲
