機構名稱,縣市,行政區,地址全址,特約服務項目,機構電話,電子郵件,機構負責人姓名
鈺心股份有限公司附設新北市私立蘆洲集賢社區長照機構,新北市,蘆洲區,新北市蘆洲區集賢路245號3樓,喘息服務,82853333,luzhou201601@gmail.com,林桂惠
耀生長期照顧服務股份有限公司附設臺北市私立耀生居家長照機構,臺北市,中正區,臺北市中正區幸市里忠孝東路2段130號11樓之8,喘息服務,02-23932500,wayne@leaplife.com.tw,蔡坤霖
潤康長期照護有限公司附設新北市私立潤康居家長照機構,新北市,中和區,新北市中和區景平路431巷68號1樓,喘息服務,0911-768-767,ringcrown1491@gmail.com,施凱鈞
適健復健科診所,臺北市,大安區,臺北市大安區忠孝東路四段166號8樓,居家失能個案家庭醫師照護服務,02-8771-7039,cj41668@gmail.com.tw,陳昭蓉
十全外科婦產科診所,新北市,中和區,新北市中和區景新街413號,居家失能個案家庭醫師照護服務,29434687,j331208@yahoo.com.tw,簡繁勝
國立臺灣大學醫學院附設醫院北護分院,臺北市,萬華區,臺北市萬華區內江街87號,居家失能個案家庭醫師照護服務,223717101,B40731@bh.ntuh.gov.tw,陳永銘
陳珀勳診所,臺北市,北投區,臺北市北投區明德路85號1樓,居家失能個案家庭醫師照護服務,02-2820-6263,pohshin@hotmail.com,陳珀勳
臺北市政府社會局委託財團法人台北市立心慈善基金會經營管理臺北市萬華龍山社區長照機構,臺北市,萬華區,臺北市萬華區青山里梧州街36號3樓之1,日間照顧服務,02-23361881,longshanold@gmail.com,洪金桐
衛生福利部基隆醫院附設南港綜合長照機構,臺北市,南港區,臺北市南港區南港路二段78號3-5樓,日間照顧服務,02-24292525,ngltc@kln.mohw.gov.tw,林三齊
社團法人臺灣大米一山健康促進協會附設新北市私立烏來區Rahaw信賢社區長照機構,新北市,烏來區,新北市烏來區信福路28號,日間照顧服務,8668-6651,liinhomecare@gmail.com,周惠貞
社團法人臺灣大米一山健康促進協會附設新北市私立烏來區Rahaw信賢社區長照機構,新北市,烏來區,新北市烏來區信福路28號,喘息服務,8668-6651,liinhomecare@gmail.com,周惠貞
新北市私立恩勤居家長照機構,新北市,板橋區,新北市板橋區文化路一段189號7樓,個案管理服務,8953-5988,kelly2266@kimo.com,陳蕙汎
樂齡智慧有限公司附設新北市私立里好綜合式長照機構,新北市,三重區,新北市三重區三和路二段30號5樓,居家服務,29766060#21,service@lihodaycare.com,李福睿
新北市私立潔怡居家長照機構,新北市,新店區,新北市新店區民權路153號4樓D室,居家服務,911392792,sppwhs@gmail.com,龍潔
新北市私立潔怡居家長照機構,新北市,新店區,新北市新店區民權路153號4樓D室,喘息服務,911392792,sppwhs@gmail.com,龍潔
常樂企業有限公司(新北),新北市,新店區,新北市新店區民權路153號4樓,交通接送服務,25238456,changlecare@gmail.com,王受益
臺北市政府社會局委託財團法人中華民國唐氏症基金會經營管理景新身障社區長照機構（日間照顧）,臺北市,文山區,臺北市文山區景後街151號4樓,喘息服務,02-29355560,jingxindaycare@gmail.com,林正俠
臺北市文山區順興社區發展協會,臺北市,文山區,臺北市文山區順興里興隆路4段165巷12號1、2樓,喘息服務,2939-5932,penny235689@hotmail.com,單連城
新北市私立溫馨園老人長期照顧中心(養護型),新北市,鶯歌區,新北市鶯歌區建國路85號4樓,喘息服務,02-26782277,wenshingyuan@gmail.com,蕭曙球
臺北市政府社會局委託社團法人中華民國紅心字會經營管理臺北市信義老人服務中心,臺北市,信義區,臺北市信義區大仁里大道路116號5樓之3,日間照顧服務,02-87870300,xinyitw@yahoo.com.tw,劉緒倫
臺北市私立雲朵社區長照機構,臺北市,中正區,臺北市中正區幸福里杭州南路1段63號4樓之1,日間照顧服務,02-23911898,pink121634@gmail.com,方明
新北市私立仁惠老人長期照顧中心(養護型),新北市,三芝區,新北市三芝區古庄里四棧橋53之11號1樓,喘息服務,2636-3222,RH5311@yahoo.com,楊玫芳
順享有限公司附設新北市私立順享居家長照機構,新北市,三重區,新北市三重區三寧街31號1樓,居家服務,29889968,shuen589@gmail.com,黃明順
順享有限公司附設新北市私立順享居家長照機構,新北市,三重區,新北市三重區三寧街31號1樓,喘息服務,29889968,shuen589@gmail.com,黃明順
千歲小兒科診所,新北市,樹林區,新北市樹林區千歲街47號1樓,居家失能個案家庭醫師照護服務,86871390,osm560601@gmail.com,歐淑美
社團法人臺灣大米一山健康促進協會,新北市,中和區,新北市中和區立德街204號3樓,營養餐飲服務,86686651,liinhomecare@gmail.com,周惠貞
玉川有限公司附設新北市私立玉川居家長照機構,新北市,三重區,新北市三重區光明里集美街247巷17號,居家服務,0936-189-236,taco062169@gmail.com,林鈺鈞
玉川有限公司附設新北市私立玉川居家長照機構,新北市,三重區,新北市三重區光明里集美街247巷17號,喘息服務,0936-189-236,taco062169@gmail.com,林鈺鈞
禾青家有限公司附設新北市私立禾青居家長照機構,新北市,永和區,新北市永和區永和路二段57號7樓(715室),居家服務,2232-7760,conrad40717@gmail.com,薛柔縈
禾青家有限公司附設新北市私立禾青居家長照機構,新北市,永和區,新北市永和區永和路二段57號7樓(715室),喘息服務,2232-7760,conrad40717@gmail.com,薛柔縈
宇婕居家長照有限公司附設新北市私立宇婕居家長照機構,新北市,瑞芳區,新北市瑞芳區中山路5號3樓,個案管理服務,987414919,ujie580@outlook.com,林擎宇
優福國際股份有限公司附設臺北市私立優福居家長照機構,臺北市,大同區,臺北市大同區延平北路三段4號5樓(521室),居家服務,0976-804-827,ufo90367886@gmail.com,李盛豊
優福國際股份有限公司附設臺北市私立優福居家長照機構,臺北市,大同區,臺北市大同區延平北路三段4號5樓(521室),喘息服務,0976-804-827,ufo90367886@gmail.com,李盛豊
達特窩可居家物理治療所,新北市,三峽區,新北市三峽區介壽路一段276巷108弄1號,專業照護服務,02-26748522,drwalk4u@gmail.com,賴維澤
台灣基督長老教會馬偕醫療財團法人附設臺北市私立大同昌吉社區長照機構,臺北市,大同區,臺北市大同區蓬萊里昌吉街52號9至10樓,日間照顧服務,02-2598-8710,yufang.3243@mmh.org.tw,蕭聰穎
沃恩有限公司附設新北市私立耆樂居家長照機構,新北市,汐止區,新北市汐止區復興里新台五路一段79號7樓B室,個案管理服務,02-86983877,w86983877@gmail.com,林顯寬
明倉健康事業股份有限公司附設新北市私立明倉居家長照機構,新北市,林口區,新北市林口區麗林里忠孝路376巷53號1樓,居家服務,02-2609-6468,mingcangcare@gmail.com,黃周月桂
明倉健康事業股份有限公司附設新北市私立明倉居家長照機構,新北市,林口區,新北市林口區麗林里忠孝路376巷53號1樓,喘息服務,02-2609-6468,mingcangcare@gmail.com,黃周月桂
明倉健康事業股份有限公司附設新北市私立明倉居家長照機構,新北市,林口區,新北市林口區麗林里忠孝路376巷53號1樓,專業照護服務,02-2609-6468,mingcangcare@gmail.com,黃周月桂
崇文診所,新北市,鶯歌區,新北市鶯歌區國慶街141號,居家失能個案家庭醫師照護服務,02-26783366,lonepair0529@gmail.com,陳仰霖
仁合健康事業有限公司附設新北市私立仁合居家長照機構,新北市,板橋區,新北市板橋區長安街331巷30號1樓,居家服務,2951-5789,Renhelc2022@gmail.com,沈佩曄
仁合健康事業有限公司附設新北市私立仁合居家長照機構,新北市,板橋區,新北市板橋區長安街331巷30號1樓,喘息服務,2951-5789,Renhelc2022@gmail.com,沈佩曄
臺北市立萬芳醫院–委託臺北醫學大學辦理附設居家護理所,臺北市,文山區,臺北市文山區萬美街一段25號B1,專業照護服務,2930-7930 #1766,110051@w.tmu.edu.tw,何雲仙
臺北榮民總醫院附設居家護理所,臺北市,北投區,臺北市北投區石牌路二段322號R2,專業照護服務,02-28712121#82517,huangms@vghtpe.gov.tw,楊素茹
新北市私立慈和老人長期照顧中心(養護型),新北市,中和區,新北市中和區中正路909號2樓,喘息服務,22212393,a58mercy@gmail.com,宋燕凌
新北市私立慈安老人長期照顧中心(養護型),新北市,中和區,新北市中和區中正路909號3樓,喘息服務,22212393,a8411@outlook.com,宋王素娥
新北市私立慈鴻老人長期照顧中心(養護型),新北市,中和區,新北市中和區中正路909號4樓,喘息服務,22212393,a8411@outlook.com,宋燕凌
新北市私立棠菓居家長照機構,新北市,板橋區,新北市板橋區中山路一段293之1號10樓之1(A09室),居家服務,952814036,candy2022888@gmail.com,陳又襄
新北市私立棠菓居家長照機構,新北市,板橋區,新北市板橋區中山路一段293之1號10樓之1(A09室),喘息服務,952814036,candy2022888@gmail.com,陳又襄
臺北市私立千意居家長照機構,臺北市,松山區,臺北市松山區中崙里復興南路一段37號2樓,居家服務,27786287,cianyi6287@gmail.com,楊歆研
社團法人台灣認知功能促進協會附設臺北市私立敬智學苑社區長照機構,臺北市,內湖區,臺北市內湖區石潭里新明路22號2樓,日間照顧服務,2790-0907,Info.tcea@tcea-taiwan.com,甄瑞興
凱風長照股份有限公司附設臺北市私立凱風新生北綜合長照機構,臺北市,中山區,臺北市中山區晴光里新生北路三段56巷17號1樓,居家服務,2599-6681,service@kfcare.com.tw,郭家展
社團法人中華民國士林靈糧堂社會福利協會附設新北市私立三芝綜合長照機構,新北市,三芝區,新北市三芝區埔坪里民生街31號1樓,個案管理服務,02-26561700,sanzhi@slsc.org.tw,劉群茂
新北市私立共笙居家長照機構,新北市,三重區,新北市三重區重新路二段21號8樓(803室),居家服務,986670831,gsjjcz999@gmail.com,賴盈如
新北市私立共笙居家長照機構,新北市,三重區,新北市三重區重新路二段21號8樓(803室),喘息服務,986670831,gsjjcz999@gmail.com,賴盈如
社團法人台灣喜樂家族協會附設臺北市私立冠冕居家長照機構,臺北市,士林區,臺北市士林區雙溪街140號1樓,居家服務,02-2832-0533,crown.homelife@gmail.com,林黃寶彩
小藥師健保藥局,臺北市,南港區,臺北市南港區百福里福德街320之1號1樓,輔具及居家無障礙環境服務,02-27867002,a0227867002@gmail.com,江芝瑩
新北市私立吉家居家長照機構,新北市,板橋區,新北市板橋區四維路291巷4弄12號1樓,居家服務,02-2258-3776,jijia.hc@gmail.com,陳安宇
新北市私立吉家居家長照機構,新北市,板橋區,新北市板橋區四維路291巷4弄12號1樓,喘息服務,02-2258-3776,jijia.hc@gmail.com,陳安宇
新北市愛笑瑜伽協會(奕壽站)(社照C),新北市,三重區,新北市三重區奕壽里新北市三重區介壽路26號,巷弄長照站,(02)8988-3840,smile.yoga.xindei2017@Gmail.com,王淑芳
新北市中和區莒東社區發展協會(社照C),新北市,中和區,新北市中和區民有里民享街37號2樓,巷弄長照站,953479779,sel3934@gmail.com,吳育舟
中化銀髮事業股份有限公司附設臺北市私立暖時光社區長照機構,臺北市,中山區,臺北市中山區長安東路二段131-1號1-3樓及131-2號2-3樓,日間照顧服務,978511719,kate.chang@ccpc.com.tw,王謝怡貞
社團法人中華兩岸養老產業發展協會附設新北市私立板橋海山社區長照機構,新北市,板橋區,新北市板橋區深丘里長安街253號1樓及2樓,喘息服務,02-89520151,haishan201410@gmail.com,黃明發
優活健康顧問有限公司附設臺北市私立優活居家長照機構,臺北市,文山區,臺北市文山區景福街133巷30號1樓,居家服務,02-2933-6682,cynthia5434@gmail.com,林亭如
瑞和診所,新北市,深坑區,新北市深坑區北深路三段99號6樓,居家失能個案家庭醫師照護服務,02-2662-3302,juihoclinic@gmail.com,洪瑞苑
臺北市政府社會局委託財團法人台北市立心慈善基金會經營管理臺北市萬華龍山社區長照機構,臺北市,萬華區,臺北市萬華區青山里梧州街36號3樓之1,營養餐飲服務,02-23361881,longshanold@gmail.com,洪金桐
暉宇有限公司附設臺北市私立星雲祥家社區長照機構,臺北市,內湖區,臺北市內湖區清白里星雲街161巷3號3樓,喘息服務,(02)2790-0898,Huiyu20201208@gmail.com,楊雋宇
新北市平溪區南山社區發展協會(社照C),新北市,平溪區,新北市平溪區南山里靜安路三段232號,巷弄長照站,2495-1510,wendy70612@gmail.com,劉清榮
臺北市政府衛生局委託臺北榮民總醫院經營管理稻香社區長照機構,臺北市,北投區,臺北市北投區稻香路81號4樓,日間照顧服務,02-28958575,daoxiangfacility@gmail.com,陳威明
康和文山樂活股份有限公司附設臺北市私立杏花學塾社區長照機構,臺北市,文山區,臺北市文山區辛亥路4段128-1號2樓,喘息服務,29356802,wsflower128@gmail.com,蔡淑芬
善誠健康事業股份有限公司附設新北市私立林口善誠社區長照機構,新北市,林口區,新北市林口區湖南里文化三路二段298號1樓,日間照顧服務,86019640,Alicia.hung@medtecs.com,林仁德
善誠健康事業股份有限公司附設新北市私立林口善誠社區長照機構,新北市,林口區,新北市林口區湖南里文化三路二段298號1樓,喘息服務,86019640,Alicia.hung@medtecs.com,林仁德
(新北)社團法人中華慈雲慈善利生推廣協會,臺北市,士林區,臺北市士林區平菁街95巷47之2號,喘息服務,02-86851138,fayu991010@gmail.com,陳永涸
新北市板橋莒光天上聖母會,新北市,板橋區,新北市板橋區莒光里文化路二段124巷8號,巷弄長照站,932947902,k0932947902@gmail.com,戴圭柱
新北市私立許量居家長照機構,新北市,淡水區,新北市淡水區北新路182巷41弄4號5樓,居家服務,906805906,twzara@gmail.com,廖月伶
新北市私立許量居家長照機構,新北市,淡水區,新北市淡水區北新路182巷41弄4號5樓,喘息服務,906805906,twzara@gmail.com,廖月伶
社團法人台灣幸扶公益協會附設新北市私立汐止社區長照機構,新北市,汐止區,新北市汐止區新昌里新台五路二段81號,喘息服務,(02)26919122,chefon23@gmail.com,鄭正
家佳健康股份有限公司附設新北市私立品綸居家長照機構,新北市,蘆洲區,新北市蘆洲區集賢路209號4樓,居家服務,8286-1811,pinlun213@hotmail.com.tw,朱瑜慈
家佳健康股份有限公司附設新北市私立品綸居家長照機構,新北市,蘆洲區,新北市蘆洲區集賢路209號4樓,喘息服務,8286-1811,pinlun213@hotmail.com.tw,朱瑜慈
優福國際股份有限公司附設臺北市私立優福居家長照機構,臺北市,大同區,臺北市大同區延平北路三段4號5樓(521室),喘息服務,0976-804-827,ufo90367886@gmail.com,李盛豊
潤田健康有限公司附設臺北市私立潤田居家長照機構,臺北市,中正區,臺北市中正區龍福里湖口街1之3號1樓,喘息服務,02-23435882,runtian0510@gmail.com,江錦珍
詠林長照社團法人附設新北市私立詠林綜合長照機構,新北市,淡水區,新北市淡水區竿蓁里中正東路一段111巷20號1至6樓,日間照顧服務,905692910,a26260766@yahoo.com.tw,黃晟恆
詠林長照社團法人附設新北市私立詠林綜合長照機構,新北市,淡水區,新北市淡水區竿蓁里中正東路一段111巷20號1至6樓,喘息服務,905692910,a26260766@yahoo.com.tw,黃晟恆
玖龍國際有限公司,新北市,汐止區,新北市汐止區新台五路一段188號4樓之1,交通接送服務,02-26382119,jiesen3536@gmail.com,江薏如
社團法人台灣喜樂家族協會附設臺北市私立冠冕居家長照機構,臺北市,士林區,臺北市士林區雙溪街140號1樓,喘息服務,02-2832-0533,crown.homelife@gmail.com,林黃寶彩
中華民國體育運動教練協會(社照C),新北市,三峽區,新北市三峽區鳶山里大勇路18之2號3樓、18之3號3樓,巷弄長照站,910315119,A098619867245@gmail.com,許美榛
互照有限公司附設新北市私立春天居家長照機構,新北市,板橋區,新北市板橋區縣民大道一段271號4樓,居家服務,0926-920-597,weilinghoho0721@gmail.com,吳坤裕
互照有限公司附設新北市私立春天居家長照機構,新北市,板橋區,新北市板橋區縣民大道一段271號4樓,喘息服務,0926-920-597,weilinghoho0721@gmail.com,吳坤裕
新北市私立恩勤居家長照機構,新北市,板橋區,新北市板橋區文化路一段189號7樓,個案管理服務,8953-5988,kelly2266@kimo.com,陳蕙汎
財團法人台北市私立愛愛院,臺北市,萬華區,臺北市萬華區大理街175巷27號,個案管理服務,02-23060493,csp1@aiai.org.tw,施武靖
樂福健康事業有限公司附設臺北市私立樂福居家長照機構,臺北市,大同區,臺北市大同區永樂里西寧北路81號5樓之2,個案管理服務,225598079,lovefu0514@gmail.com,吳海銘
樂福健康事業有限公司附設臺北市私立樂福居家長照機構,臺北市,大同區,臺北市大同區永樂里西寧北路81號5樓之2,個案管理服務,225598079,lovefu0514@gmail.com,吳海銘
愛志股份有限公司附設臺北市私立愛志居家長照機構,臺北市,南港區,臺北市南港區東新里重陽路120號3樓309室,個案管理服務,02-27882211,service@earth-want.com.tw,森山典明
沃恩有限公司附設新北市私立耆樂居家長照機構,新北市,汐止區,新北市汐止區復興里新台五路一段79號7樓B室,個案管理服務,02-86983877,w86983877@gmail.com,林顯寬
財團法人天下為公社會福利慈善事業基金會,臺北市,士林區,臺北市士林區承德路4段306號9樓,個案管理服務,02-28881056,kcw@mail.oit.edu.tw,胡世賢
財團法人伊甸社會福利基金會,臺北市,文山區,臺北市文山區萬芳里萬美街一段55號3樓,個案管理服務,02-22307715,eden8378@eden.org.tw,羅紀琼
財團法人台灣省私立健順養護中心,新北市,深坑區,新北市深坑區昇高里王軍寮9號,個案管理服務,26622499,d6622499@ms26.hinet.net,黃禎祥
嘉陞健康事業股份有限公司附設臺北市私立嘉陞居家長照機構,臺北市,大同區,臺北市大同區民權西路136號15樓之3,居家服務,0921-148107,goodcare0001@gmail.com,黃海同
凱風長照股份有限公司附設臺北市私立凱風新生北綜合長照機構,臺北市,中山區,臺北市中山區晴光里新生北路三段56巷17號1樓,喘息服務,2599-6681,service@kfcare.com.tw,郭家展
清山交通有限公司,臺北市,松山區,臺北市松山區八德路四段678號7樓之7,交通接送服務,02-27457715,cingshan28@gmail.com,林青駿
新北市私立馨中居家長照機構,新北市,鶯歌區,新北市鶯歌區信義街54號1樓,居家服務,902389689,a86862039@gmail.com, 陳彥璁
新北市私立馨中居家長照機構,新北市,鶯歌區,新北市鶯歌區信義街54號1樓,喘息服務,902389689,a86862039@gmail.com, 陳彥璁
振興醫療財團法人附設振興居家護理所,臺北市,北投區,臺北市北投區榮華里振興街45號,專業照護服務,02-28264400,ch7727@chgh.org.tw,李怡慧
稻香居家護理所(委託臺北榮民總醫院經營管理),臺北市,北投區,臺北市北投區稻香路81號,專業照護服務,02-2895-6015,ccli2@vghtpe.gov.tw,李淑娟
福鷺社會企業有限公司附設新北市私立三重福鷺社區長照機構,新北市,三重區,新北市三重區正義北路195號4樓、4樓之1,日間照顧服務,2988-0501,fuluseltc@gmail.com,張凱智
福鷺社會企業有限公司附設新北市私立三重福鷺社區長照機構,新北市,三重區,新北市三重區正義北路195號4樓、4樓之1,喘息服務,2988-0501,fuluseltc@gmail.com,張凱智
邦鄰居家服務有限公司附設新北市私立邦鄰居家長照機構,新北市,中和區,新北市中和區健康路89號3樓,居家服務,8228-1850,banglin808080@gmail.com,吳銀蓮
邦鄰居家服務有限公司附設新北市私立邦鄰居家長照機構,新北市,中和區,新北市中和區健康路89號3樓,喘息服務,8228-1850,banglin808080@gmail.com,吳銀蓮
築燭有限公司附設新北市私立心地居家長照機構,新北市,中和區,新北市中和區健康路89號3樓11室,居家服務,7752-2588,ouyang8574@gmail.com,游寶蓮
築燭有限公司附設新北市私立心地居家長照機構,新北市,中和區,新北市中和區健康路89號3樓11室,喘息服務,7752-2588,ouyang8574@gmail.com,游寶蓮
新北市私立旺福居家長照機構,新北市,三重區,新北市三重區溪美里福隆路48號1樓,個案管理服務,02-28571526,wfservice2@gmail.com,黃雅萍
財團法人天主教失智老人社會福利基金會,臺北市,萬華區,臺北市萬華區德昌街125巷11號,個案管理服務,02-23096500,a23096500@gmail.com,鍾安住
新北市私立惠眾居家長照機構,新北市,淡水區,新北市淡水區民權路111號3樓C06室,居家服務,28085212,huizhong2023@gmail.com,陳愉芳
新北市私立惠眾居家長照機構,新北市,淡水區,新北市淡水區民權路111號3樓C06室,喘息服務,28085212,huizhong2023@gmail.com,陳愉芳
天使居長照財團法人附設新北市私立天使居居家長照機構,新北市,林口區,新北市林口區東勢里文化一路一段150之2號,居家服務,26006088,machun786@gmail.com,王建煊
天使居長照財團法人附設新北市私立天使居居家長照機構,新北市,林口區,新北市林口區東勢里文化一路一段150之2號,喘息服務,26006088,machun786@gmail.com,王建煊
臺北市私立上美老人長期照顧中心(養護型),臺北市,士林區,臺北市士林區重慶北路四段162號,喘息服務,02-28122366,yilien3@hotmail.com,李依蓮
潤田健康有限公司附設臺北市私立潤田居家長照機構,臺北市,中正區,臺北市中正區龍福里湖口街1之3號1樓,居家服務,02-23435882,runtian0510@gmail.com,江錦珍
優福國際股份有限公司附設臺北市私立優福居家長照機構,臺北市,大同區,臺北市大同區延平北路三段4號5樓(521室),居家服務,0976-804-827,ufo90367886@gmail.com,李盛豊
煦橙股份有限公司附設新北市私立新店煦橙綜合長照機構,新北市,新店區,新北市新店區廣明里光明街98之1號4樓,居家服務,(02)8919-3656,morange3656@gmail.com,蔡雅伶
煦橙股份有限公司附設新北市私立新店煦橙綜合長照機構,新北市,新店區,新北市新店區廣明里光明街98之1號4樓,喘息服務,(02)8919-3656,morange3656@gmail.com,蔡雅伶
煦橙股份有限公司附設新北市私立新店煦橙綜合長照機構,新北市,新店區,新北市新店區廣明里光明街98之1號4樓,日間照顧服務,(02)8919-3656,morange3656@gmail.com,蔡雅伶
寶安健康有限公司附設臺北市私立鑫安居家長照機構,臺北市,文山區,臺北市文山區興隆路三段206巷10弄1號,居家服務,02-2230-3056,baoan206101@gmail.com,廖麗如
臺北市中山區朱厝崙社區發展協會,臺北市,中山區,臺北市中山區朱崙里龍江路15號3樓,喘息服務,2781-5504,teak4747@yahoo.com.tw,高銘鴻
辰逸有限公司附設臺北市私立辰逸居家長照機構,臺北市,中山區,臺北市中山區中央里南京東路2段137號14樓(109室),喘息服務,02-7755-3620,cypmc00@gmail.com,王超凡
財團法人天主教失智老人社會福利基金會受託經營管理本市萬華老人服務中心,臺北市,萬華區,臺北市萬華區西寧南路4號A棟3樓,營養餐飲服務,2361-0666,who.cfad@gmail.com,鍾安住
財團法人私立健順養護中心受託經營管理本市南港老人服務中心,臺北市,南港區,臺北市南港區重陽路187巷5號1、2樓,營養餐飲服務,26535311,nkelder@gmail.com,黃禎祥
吉雅健康股份有限公司附設新北市私立樂心居家長照機構,新北市,永和區,新北市永和區福和路159號3樓,居家服務,2922-1368,lyne.chiu@gmail.com,邱琳婷
吉雅健康股份有限公司附設新北市私立樂心居家長照機構,新北市,永和區,新北市永和區福和路159號3樓,喘息服務,2922-1368,lyne.chiu@gmail.com,邱琳婷
新北市平溪區老人會(社照C),新北市,平溪區,新北市平溪區嶺腳里靜安路二段531號,巷弄長照站,24952328,pojongl@gmail.com,楊明仁
臺北市私立祝福居家長照機構,臺北市,中正區,臺北市中正區水源里羅斯福路4段68號7樓之10（6810-E室）,喘息服務,02-29321396,nikey303@gmail.com,鄭如杏
臺北市私立祝福居家長照機構,臺北市,中正區,臺北市中正區水源里羅斯福路4段68號7樓之10（6810-E室）,專業照護服務,02-29321396,nikey303@gmail.com,鄭如杏
新北市私立瑞昇老人長期照顧中心(養護型),新北市,板橋區,新北市板橋區四川路2段16巷1號1樓,交通接送服務,89675498,tsenglt123@hotmail.com,曾巫秀琴
丁大元診所,臺北市,內湖區,臺北市內湖區東湖路119巷49弄4號,居家失能個案家庭醫師照護服務,02-26331010,dauyuan@hotmail.com,丁大元
惠安護康科技有限公司附設臺北市私立惠安居家長照機構,臺北市,文山區,臺北市文山區興隆路2段86巷2號1樓,喘息服務,0952-654002,vicky6575@gmail.com,詹益發
知恩長期照護有限公司附設新北市私立知恩居家長照機構,新北市,板橋區,新北市板橋區中山路一段1號13樓之26(A06),居家服務,0980-427-952,ases50424@gmail.com,吳詩婕
